{
  "schema": 1,
  "contract_version": "1.2.0",
  "root": "/project",
  "names": null,
  "names_error": null,
  "last_run": null,
  "n_runs": 0,
  "last_pin": null,
  "n_pins": 0,
  "selection": null,
  "selection_error": null,
  "ledger_error": null,
  "host": {
    "running": false,
    "pid": null,
    "phase": null,
    "stale": false
  },
  "project": null,
  "busy": {
    "busy": false,
    "pid": null,
    "op": null,
    "phase": null,
    "script": null,
    "stale": false
  },
  "empty": true,
  "ok": true,
  "error": null
}
